{
  "schema": "design-pipeline.playground.v1",
  "changeId": "component-design-adjustment",
  "applicability": {
    "status": "required",
    "reason": "parameter-sensitive",
    "rationale": "The user must choose and adjust the strategy against a live preview."
  },
  "surface": {
    "kind": "component",
    "blueprint": {
      "source": "builtin",
      "id": "design-playground"
    },
    "title": "Component design adjustment",
    "context": "Choose and adjust the initial strategy for Component design adjustment.",
    "artifact": {
      "path": "playground/index.html",
      "sha256": "daf05aa6aa2759a18766f3bef7d268090196497595b3e401004687c3eb637a41"
    },
    "controls": [
      {
        "id": "radius",
        "label": "Corner radius",
        "group": "Shape",
        "type": "range",
        "default": 12,
        "min": 0,
        "max": 32,
        "step": 1
      },
      {
        "id": "density",
        "label": "Density",
        "group": "Layout",
        "type": "select",
        "default": "balanced",
        "options": [
          "airy",
          "balanced",
          "compact"
        ]
      },
      {
        "id": "outlined",
        "label": "Outlined",
        "group": "Material",
        "type": "checkbox",
        "default": true
      }
    ],
    "presets": [
      {
        "id": "calm",
        "name": "Calm",
        "values": {
          "radius": 12,
          "density": "airy",
          "outlined": true
        }
      },
      {
        "id": "compact",
        "name": "Compact",
        "values": {
          "radius": 8,
          "density": "compact",
          "outlined": true
        }
      },
      {
        "id": "bold",
        "name": "Bold",
        "values": {
          "radius": 20,
          "density": "balanced",
          "outlined": false
        }
      }
    ]
  },
  "selection": {
    "status": "selected",
    "values": {
      "radius": 8,
      "density": "compact",
      "outlined": true
    },
    "changedControlIds": [
      "radius",
      "density"
    ],
    "stateSha256": "7f547d47079b125b3ac03d0047588f9f6f42077e7fd2bc8af70b0928b09e7086",
    "prompt": {
      "path": "playground/selection-prompt.md",
      "sha256": "ee9b5af1f00f075854d0748fbe0845cc9f1352dcd62d999ed54e171b307b89be"
    }
  },
  "verification": {
    "status": "passed",
    "method": "manual-browser",
    "checkedAt": "2026-08-15T00:00:00.000Z",
    "surfaceSha256": "07258a8bf5949c67867224823909f3c3d72843a512c112ce3e5f243599b8d8b1",
    "checks": {
      "everyControlUpdatesState": true,
      "everyPresetAppliesDeclaredState": true,
      "previewUpdatesImmediately": true,
      "promptUpdatesImmediately": true,
      "copyMatchesPrompt": true,
      "keyboardOperable": true
    },
    "evidence": {
      "path": "playground/verification.json",
      "sha256": "569aa12af974a5f536836bfeee587ca3e1add366b3f253e01f5fae765e0b2abc"
    }
  },
  "integration": {
    "status": "applied",
    "target": {
      "path": "design.md",
      "sha256": "d4ccca04594c6e3cd6354c23da2c5dfe808cd955a621e8a01ac39377330dc910"
    }
  }
}
